<application-context xmlns="http://www.spicefactory.org/parsley/1.0"
		xmlns:xsi="http://www.w3.org/2001/XMLSchema-instance"
		xsi:schemaLocation="http://www.spicefactory.org/parsley/1.0 
			http://www.spicefactory.org/parsley/schema/1.0/parsley-context.xsd"
		>
    <setup>
       <expressions>
           <variable name="test"><uint>34</uint></variable>
       </expressions>
    </setup>
	<factory>
		<object id="classA" type="org.spicefactory.parsley.config.testmodel.ClassA">
			<property name="uintProp" value="${test}"/>
			<property name="stringProp" value="${test2}"/>
		</object>
	</factory>
</application-context>